{
  "$comment": "GENERATED by contracts/codegen/generate.py from sidecar.schema.yaml - DO NOT EDIT.",
  "$schema": "https://json-schema.org/draft/2020-12/schema",
  "additionalProperties": true,
  "description": "On-card episode record written by discardd at capture (CONTRACT \u00a72).",
  "if": {
    "properties": {
      "schema": {
        "pattern": "^eunomia-sidecar/v[1-9][0-9]*$"
      }
    },
    "required": [
      "schema"
    ]
  },
  "properties": {
    "files": {
      "additionalProperties": true,
      "description": "The clip file(s) the sidecar describes (the .insv/.mp4 extension flip is tolerated, \u00a72.1).",
      "properties": {
        "back": {
          "description": "The actual clip file the sidecar describes (the hard-required pointer, \u00a72.1).",
          "type": "string"
        }
      },
      "required": [
        "back"
      ],
      "type": "object"
    },
    "global_episode_seq": {
      "description": "NAND swap-proof monotonic ordinal; the PRIMARY ordering spine (card is not a unit).",
      "type": "integer"
    },
    "identity": {
      "additionalProperties": true,
      "description": "Who/what/where/which-take. Resolved-as-of-recording precedence lives at ingest (\u00a73.3).",
      "properties": {
        "assignment_source": {
          "description": "Assignment provenance.",
          "type": "string"
        },
        "bimanual_episode_id": {
          "description": "Fob-injected shared L/R id; pairs the two wrist cams of ONE take with no order-join.",
          "type": "string"
        },
        "calibration_id": {
          "description": "Optional reference to a calibration entity (scope none/fleet/per_camera; \u00a73.1, C-11).",
          "type": [
            "string",
            "null"
          ]
        },
        "camera_id": {
          "description": "Camera body identity (provenance; never decides the kit, \u00a73.3).",
          "type": "string"
        },
        "display_id": {
          "description": "DERIVED human handle <YYYYMMDD>_<operator>_<station>_<NNNNNN>; never a key (\u00a77).",
          "type": "string"
        },
        "episode_id": {
          "description": "UUIDv4 pairing/join key, minted by the fob, identical on both arms (\u00a77). The ONLY join key.",
          "type": "string"
        },
        "episode_ordinal": {
          "description": "The fob label ordinal (distinct from global_episode_seq; the label-join source).",
          "type": "integer"
        },
        "kit_id": {
          "description": "The kit (from the fob). HARD-non-empty \u2014 decides canonical naming + pairing.",
          "minLength": 1,
          "type": "string"
        },
        "mount": {
          "description": "Mount provenance.",
          "type": "string"
        },
        "operator_id": {
          "description": "Operator/person handle (roster binding cross-checked at ingest).",
          "type": "string"
        },
        "prompt": {
          "description": "Task prompt (v1-extra HARD \u2014 required when schema declares v1+, \u00a72.2/OQ-4).",
          "type": "string"
        },
        "record_settings": {
          "description": "Resolution/fps/stabilization descriptor (3K/100, FlowState off, audio-on).",
          "type": "string"
        },
        "rotation_id": {
          "description": "Rotation identity.",
          "type": "string"
        },
        "session_id": {
          "description": "Shift/session identity.",
          "type": "string"
        },
        "setup_version_id": {
          "description": "Setup configuration this episode was recorded under (V1 catalog). Null until fob firmware writes it.",
          "type": [
            "string",
            "null"
          ]
        },
        "side": {
          "description": "Camera side (from the camera NAND). HARD-non-empty \u2014 decides L/R pairing.",
          "enum": [
            "left",
            "right"
          ],
          "minLength": 1,
          "type": "string"
        },
        "station_id": {
          "description": "Station identity.",
          "type": "string"
        },
        "task_id": {
          "description": "Task identity (the task menu entry).",
          "type": "string"
        },
        "task_name": {
          "description": "Human task name.",
          "type": "string"
        },
        "task_source": {
          "description": "Where the task came from (v1-extra HARD; the task-precedence winner, \u00a73.5).",
          "enum": [
            "nand_staged",
            "sd_assignment",
            "none"
          ],
          "type": "string"
        }
      },
      "required": [
        "camera_id",
        "kit_id",
        "side",
        "operator_id",
        "station_id",
        "task_id",
        "task_name",
        "session_id",
        "episode_id",
        "rotation_id"
      ],
      "type": "object"
    },
    "outcome": {
      "additionalProperties": true,
      "description": "Why the take ended + the operator/coordinator outcome flags (distinct from completeness).",
      "properties": {
        "archive": {
          "description": "0/1 \u2014 operator marked DESCARTAR (soft discard); ingest routes archive==1 to the archive bucket.",
          "type": "integer"
        },
        "recording_suspect": {
          "description": "0/1 \u2014 NET-NEW; coordinator could not confirm the clip grew (the no-SD trap, \u00a72.2).",
          "type": "integer"
        },
        "stop_reason": {
          "description": "WHY the take ended.",
          "enum": [
            "operator",
            "timer",
            "card_full",
            "battery",
            "error",
            "overheat"
          ],
          "type": "string"
        }
      },
      "required": [],
      "type": "object"
    },
    "provenance": {
      "additionalProperties": true,
      "description": "The forensic capture-stack identity \u2014 how a consumer filters by the producing build (\u00a72.2, B-9).",
      "properties": {
        "camera_firmware": {
          "description": "Insta360 fw, self-read by discardd.",
          "type": "string"
        },
        "fob_build": {
          "description": "Fob firmware build.",
          "type": "string"
        },
        "fob_id": {
          "description": "The coordinator fob that triggered the take.",
          "type": "string"
        },
        "kit_version": {
          "description": "discardd firmware version.",
          "type": "string"
        },
        "modality": {
          "description": "Capture modality; the teleop-generality field (Eunomia today is always umi, \u00a71.1/B-9).",
          "enum": [
            "umi",
            "teleop"
          ],
          "type": "string"
        },
        "site_id": {
          "description": "Site identity.",
          "type": "string"
        }
      },
      "required": [],
      "type": "object"
    },
    "record_format_version": {
      "description": "Writer-owned monotonic int; forensic build-scoping by query. Warn so old cards validate (\u00a75).",
      "type": "integer"
    },
    "schema": {
      "description": "Schema identifier; tells a parser which fields to expect (additive semver, \u00a75).",
      "enum": [
        "eunomia-sidecar/v1"
      ],
      "type": "string"
    },
    "seq": {
      "description": "Per-card filename seq counter (numeric, \u00a72.2). Distinct from the fob ordinal.",
      "type": "integer"
    },
    "timing": {
      "additionalProperties": true,
      "description": "Per-camera clip-derived start/stop + the fob-measured cross-cam skew. Numbers loose by design.",
      "properties": {
        "camera_clock": {
          "description": "PROVENANCE-ONLY (the X3 has no RTC; its clock is POISON \u2014 never used for ordering, \u00a72.2).",
          "type": [
            "string",
            "null"
          ]
        },
        "start_skew_ms": {
          "description": "Fob-measured cross-cam start skew (the at-capture inter-arm-skew prior).",
          "type": "number"
        },
        "started_unix": {
          "description": "Clip-derived start (discardd derives from the file).",
          "type": "number"
        },
        "stopped_unix": {
          "description": "Clip-derived stop.",
          "type": "number"
        }
      },
      "required": [],
      "type": "object"
    }
  },
  "required": [
    "schema",
    "seq",
    "global_episode_seq",
    "identity",
    "files"
  ],
  "then": {
    "properties": {
      "identity": {
        "required": [
          "prompt",
          "task_source"
        ]
      }
    }
  },
  "title": "Sidecar",
  "type": "object"
}
