{
  "files": {
    "back": "VID_20260624_100000_00_042.insv"
  },
  "global_episode_seq": 1009,
  "identity": {
    "assignment_source": "fob",
    "bimanual_episode_id": "bi_88",
    "calibration_id": "cal_fleet_1",
    "camera_id": "cam_A",
    "display_id": "20260624_op123_5_000012",
    "episode_id": "550e8400-e29b-41d4-a716-446655440000",
    "episode_ordinal": 12,
    "kit_id": "kit_07",
    "mount": "wrist_left",
    "operator_id": "op_123",
    "prompt": "fold the towel into the bin",
    "record_settings": "3K100_fsoff_audioon",
    "rotation_id": "r2",
    "session_id": "sess_xyz",
    "setup_version_id": "umi-bimanual-v1",
    "side": "left",
    "station_id": "5",
    "task_id": "t_fold",
    "task_name": "Fold the towel",
    "task_source": "sd_assignment"
  },
  "outcome": {
    "archive": 0,
    "recording_suspect": 0,
    "stop_reason": "operator"
  },
  "provenance": {
    "camera_firmware": "1.1.6",
    "fob_build": "3.8.3",
    "fob_id": "fob_3",
    "kit_version": "discardd-2.0",
    "modality": "umi",
    "site_id": "mx_1"
  },
  "record_format_version": 3,
  "schema": "eunomia-sidecar/v1",
  "seq": 42,
  "timing": {
    "camera_clock": "2026-06-24T10:00:00Z",
    "start_skew_ms": 12.0,
    "started_unix": 1750000000.5,
    "stopped_unix": 1750000123.0
  }
}
